<?xml version="1.0" encoding="UTF-8"?>

<xs:schema xmlns:xs="http://www.w3.org/2001/XMLSchema"
           targetNamespace="http://www.nure.ua"
           xmlns="http://www.nure.ua"
           elementFormDefault="qualified">

    <xs:element name = "university">
        <xs:complexType>
            <xs:sequence>

                <xs:element name="group" minOccurs="0" maxOccurs="unbounded">
                    <xs:complexType>
                        <xs:sequence>
                            <xs:element name="student" minOccurs="0" maxOccurs="unbounded">
                                <xs:complexType>
                                        <xs:attribute type="xs:integer" name="id"/>
                                        <xs:attribute type="xs:string" name="firstName"/>
                                        <xs:attribute type="xs:string" name="lastName"/>
                                </xs:complexType>
                            </xs:element>
                        </xs:sequence>
                        <xs:attribute type="xs:integer" name="id"/>
                        <xs:attribute type="xs:string" name="name"/>
                        <xs:attribute type="xs:integer" name="course"/>
                    </xs:complexType>
                </xs:element>

            </xs:sequence>
        </xs:complexType>
    </xs:element>

</xs:schema>
